{"schemaVersion":1,"id":"20261026T035603Z","generatedAt":"2026-10-26T03:56:03.209Z","repo":{"owner":"ceph","name":"ceph","url":"https://github.com/ceph/ceph"},"site":{"title":"Ceph PR Radar","refreshHours":3,"staleAfterHours":9},"collection":{"totalOpen":17,"listed":17,"fetched":16,"failed":[],"cachedFresh":0,"stale":0,"missing":1,"partial":true,"notes":["Sample dataset generated from test fixtures; not live data.","1 PR(s) have no detail data yet (only list metadata); their scores are incomplete."],"apiCost":0,"apiRequests":0,"rateLimitRemaining":null,"source":"sample","startedAt":"2026-10-26T03:56:03.209Z","finishedAt":"2026-10-26T03:56:03.229Z"},"windows":[{"key":"24h","hours":24},{"key":"7d","hours":168},{"key":"30d","hours":720}],"scoring":{"trending":{"halfLifeHours":72,"lookbackDays":14,"recentDays":7,"baselineDays":28,"weights":{"comment":1,"reviewVerdict":3,"reviewSummary":1.5,"reviewInlineComment":0.5,"reviewInlineCapPerReview":10,"push":2,"pushesPerDayCap":2,"participant":1,"participantCap":10},"sizeFactor":{"perDecade":0.08,"max":0.25},"acceleration":{"slope":0.3,"min":0.75,"max":1.75,"minBaselineDays":14},"unusual":{"madMultiplier":3,"minWeightedEvents":10}},"importance":{"minScore":30,"scale":40,"assignThreshold":10,"keywordCap":12,"labelCap":10,"secondarySubsystemWeight":0.25,"secondarySubsystemCap":12,"mechanicalMultiplier":0.6,"backportMultiplier":0.6,"mainBranches":["main","master"],"churn":{"floor":0.4,"perDecade":0.2},"maxRelevantFiles":10},"population":{"median":2.5,"mad":1.5,"threshold":10,"population":14}},"subsystems":[{"id":"bluestore","name":"BlueStore","description":"On-disk layout, blobs/extents, allocation, checksums/compression, BlueFS and the BlueStore write path."},{"id":"rocksdb","name":"RocksDB & metadata","description":"RocksDB integration and tuning, WAL/compaction, OMAP and key-value metadata performance."},{"id":"crimson","name":"Crimson & Seastar","description":"Crimson OSD, SeaStore, sharded execution, cross-core messaging, async I/O, messenger and SPDK integration."},{"id":"osd-perf","name":"OSD performance","description":"Replicated/EC I/O paths, messenger, threading/locking, scheduling, recovery/backfill/peering performance."},{"id":"memory","name":"Memory management","description":"Allocation, caches and eviction, buffer lifetime/refcounting, leaks, fragmentation, memory pressure."},{"id":"cephfs","name":"CephFS","description":"MDS metadata cache, locking and journaling, subtree migration and balancing, snapshots and quotas, the client/libcephfs I/O path, mirroring and MDS map handling."},{"id":"architecture","name":"Major architectural changes","description":"New abstractions or subsystem boundaries, core interfaces/data structures, transaction semantics, concurrency model, cross-subsystem refactors."}],"history":{"comparedTo":"2026-10-25T03:56:03.209Z","snapshots":1},"prs":[{"number":61017,"title":"mds: fix deadlock between subtree export and rename during migration","url":"https://github.com/ceph/ceph/pull/61017","author":"mdsdev","isDraft":false,"baseRef":"main","labels":["cephfs"],"createdAt":"2026-10-18T03:56:03.209Z","updatedAt":"2026-10-22T09:56:03.209Z","lastActivityAt":"2026-10-22T09:56:03.209Z","additions":142,"deletions":32,"changedFiles":4,"ciState":"SUCCESS","detail":"fresh","fetchedAt":"2026-10-26T03:56:03.209Z","totals":{"comments":1,"reviews":0,"commits":2},"metrics":{"24h":{"comments":0,"reviews":0,"verdicts":0,"reviewComments":0,"commits":0,"pushes":0,"participants":0},"7d":{"comments":1,"reviews":0,"verdicts":0,"reviewComments":0,"commits":2,"pushes":1,"participants":1},"30d":{"comments":1,"reviews":0,"verdicts":0,"reviewComments":0,"commits":2,"pushes":1,"participants":1}},"trending":{"score":2,"base":2,"components":{"discussion":1.4,"review":0,"code":0.6},"acceleration":{"basis":"new-pr","ratio":null,"multiplier":1,"recentWeighted":3,"baselineWeeklyWeighted":null},"unusual":false,"explanation":["1 comment from 1 other participant in 7d","1 code push in 7d","new PR: no earlier baseline to compare against"],"rank":7,"previousRank":null},"technical":{"score":63,"raw":40.2,"important":true,"confidence":"high","subsystems":[{"id":"cephfs","score":59,"confidence":"high","evidence":[{"type":"path","detail":"MDS distributed locking / capabilities (1 file, 39 lines)","weight":14.4,"files":["src/mds/Locker.cc"]},{"type":"path","detail":"subtree migration and balancing (1 file, 70 lines)","weight":13.9,"files":["src/mds/Migrator.cc"]},{"type":"path","detail":"MDS metadata cache (1 file, 5 lines)","weight":12.2,"files":["src/mds/MDCache.h"]},{"type":"label","detail":"label \"cephfs\"","weight":8},{"type":"keyword","detail":"title mentions \"mds\"","weight":5},{"type":"keyword","detail":"title mentions \"subtree\"","weight":4},{"type":"keyword","detail":"description mentions \"inode\"","weight":1.5}]}],"signals":[{"type":"signal","detail":"Mentions a regression, corruption, data loss or crash: title says \"deadlock\"","weight":6},{"type":"signal","detail":"Mentions locking, threading or concurrency changes: description says \"lock\"","weight":2}],"explanation":"CephFS: MDS distributed locking / capabilities (1 file, 39 lines); Mentions a regression, corruption, data loss or crash: title says \"deadlock\"; title describes a move/rename/cleanup (weighted down).","coreLines":114,"flags":{"backport":false,"mechanical":true,"testOnly":false,"docsOnly":false,"filesTruncated":false}},"files":[{"path":"src/mds/Migrator.cc","additions":48,"deletions":22,"relevant":true},{"path":"src/mds/Locker.cc","additions":30,"deletions":9,"relevant":true},{"path":"src/mds/MDCache.h","additions":4,"deletions":1,"relevant":true},{"path":"qa/tasks/cephfs/test_exports.py","additions":60,"deletions":0,"relevant":false}]},{"number":61016,"title":"osd/scheduler: fix mClock cost calculation for recovery ops","url":"https://github.com/ceph/ceph/pull/61016","author":"schedev","isDraft":false,"baseRef":"main","labels":["performance"],"createdAt":"2026-06-28T03:56:03.209Z","updatedAt":"2026-10-26T01:56:03.209Z","lastActivityAt":"2026-10-26T01:56:03.209Z","additions":55,"deletions":22,"changedFiles":2,"ciState":"SUCCESS","detail":"fresh","fetchedAt":"2026-10-26T03:56:03.209Z","totals":{"comments":12,"reviews":3,"commits":3},"metrics":{"24h":{"comments":4,"reviews":2,"verdicts":2,"reviewComments":4,"commits":1,"pushes":1,"participants":3},"7d":{"comments":10,"reviews":3,"verdicts":2,"reviewComments":6,"commits":1,"pushes":1,"participants":3},"30d":{"comments":11,"reviews":3,"verdicts":2,"reviewComments":6,"commits":1,"pushes":1,"participants":3}},"trending":{"score":35.2,"base":20.1,"components":{"discussion":10.7,"review":7.5,"code":2},"acceleration":{"basis":"own-history","ratio":17.6,"multiplier":1.75,"recentWeighted":21,"baselineWeeklyWeighted":0.3},"unusual":true,"explanation":["3 reviews (2 approve/request-changes), 6 inline comments in 7d","10 comments from 3 other participants in 7d","1 code push in 7d","17.6× its previous weekly activity","recent activity 21 vs 2.5 for a typical active PR"],"rank":2,"previousRank":null},"technical":{"score":50,"raw":27.5,"important":true,"confidence":"high","subsystems":[{"id":"osd-perf","score":27.5,"confidence":"high","evidence":[{"type":"path","detail":"op scheduler (mClock/WPQ) (2 files, 77 lines)","weight":12.5,"files":["src/osd/scheduler/mClockScheduler.cc","src/osd/scheduler/mClockScheduler.h"]},{"type":"label","detail":"label \"performance\"","weight":8},{"type":"keyword","detail":"title mentions \"mClock\"","weight":4},{"type":"keyword","detail":"title mentions \"recovery\"","weight":3}]}],"signals":[],"explanation":"OSD performance: op scheduler (mClock/WPQ) (2 files, 77 lines).","coreLines":77,"flags":{"backport":false,"mechanical":false,"testOnly":false,"docsOnly":false,"filesTruncated":false}},"files":[{"path":"src/osd/scheduler/mClockScheduler.cc","additions":45,"deletions":20,"relevant":true},{"path":"src/osd/scheduler/mClockScheduler.h","additions":10,"deletions":2,"relevant":true}]},{"number":61015,"title":"os: introduce ObjectStore::Transaction v2 interface with explicit ordering semantics","url":"https://github.com/ceph/ceph/pull/61015","author":"archdev","isDraft":false,"baseRef":"main","labels":["core"],"createdAt":"2026-10-06T03:56:03.209Z","updatedAt":"2026-10-13T15:56:03.209Z","lastActivityAt":"2026-10-13T15:56:03.209Z","additions":1680,"deletions":450,"changedFiles":9,"ciState":"SUCCESS","detail":"fresh","fetchedAt":"2026-10-26T03:56:03.209Z","totals":{"comments":0,"reviews":0,"commits":6},"metrics":{"24h":{"comments":0,"reviews":0,"verdicts":0,"reviewComments":0,"commits":0,"pushes":0,"participants":0},"7d":{"comments":0,"reviews":0,"verdicts":0,"reviewComments":0,"commits":0,"pushes":0,"participants":0},"30d":{"comments":0,"reviews":0,"verdicts":0,"reviewComments":0,"commits":6,"pushes":1,"participants":0}},"trending":{"score":0.1,"base":0.1,"components":{"discussion":0,"review":0,"code":0.1},"acceleration":{"basis":"new-pr","ratio":null,"multiplier":1,"recentWeighted":0,"baselineWeeklyWeighted":null},"unusual":false,"explanation":["new PR: no earlier baseline to compare against"],"rank":16,"previousRank":null},"technical":{"score":90,"raw":91.3,"important":true,"confidence":"high","subsystems":[{"id":"architecture","score":72.3,"confidence":"high","evidence":[{"type":"path","detail":"ObjectStore transaction encoding/semantics (2 files, 780 lines)","weight":21.5,"files":["src/os/Transaction.h","src/os/Transaction.cc"]},{"type":"path","detail":"ObjectStore interface (transaction semantics) (1 file, 290 lines)","weight":19.6,"files":["src/os/ObjectStore.h"]},{"type":"path","detail":"Crimson store interface (1 file, 60 lines)","weight":12.1,"files":["src/crimson/os/futurized_store.h"]},{"type":"breadth","detail":"substantial changes across 4 core areas: src/os, src/os/bluestore, src/osd, src/crimson/os","weight":12},{"type":"label","detail":"label \"core\"","weight":3},{"type":"keyword","detail":"description mentions \"Introdu